{
  "schema": "hebrinex.legacy_migration_baseline",
  "schema_version": 1,
  "source_version": "0.16.0",
  "source_ref": "v0.16.0",
  "generated_at": "1970-01-01T00:00:00.0000000Z",
  "inventory_scope": "release_manifest",
  "source_manifest_sha256": "0000000000000000000000000000000000000000000000000000000000000000",
  "tree_sha256": "0000000000000000000000000000000000000000000000000000000000000000",
  "files": []
}
